file_name,text,sentiment,happy,sad,anger,surprise,disgust,fear
1614.wav,"In the client-freelancer relationship, just like in any relationship, communication is key",1.3333334,2.0,0.0,0.0,0.0,0.0,0.0
1615.wav,"It's especially important, too, if the client is in another country, as many of mine are",1.3333334,1.3333334,0.0,0.0,0.0,0.0,0.0
1616.wav,"I mentioned in the last video about invoicing that when you send an invoice to a client you should spell out the important details in an email, too",1.0,1.0,0.0,0.0,0.0,0.0,0.0
1617.wav,"And now an interesting question to ask is how do people actually set prices in real life? Well, why don't look around and ask? If you ask your, let's say, restaurant uncle, he would probably say ""I take the cost something on top so that I will earn some money"" and this is what we call markup pricing",0.33333334,0.33333334,0.0,0.0,0.0,0.0,0.0
1618.wav, Is he earning profits? Of course,0.6666667,0.0,0.0,0.0,0.6666667,0.0,0.0
1619.wav," The maximum? Well, you may not be very sure",-0.33333334,0.0,0.0,0.0,0.33333334,0.0,0.0
1620.wav, Here look at this diagram,-0.33333334,0.0,0.0,0.0,0.0,0.0,0.0
1621.wav," First you draw the AC curve, then the AR curve",0.0,0.0,0.0,0.0,0.0,0.0,0.0
1622.wav, Where is the profit maximized? That is where the distance between the two is maximum,0.0,0.0,0.0,0.0,0.0,0.0,0.0
1623.wav," And where is the difference between the price and cost the most? So, it's here where it's the mark we have aligned",-0.6666667,0.0,0.0,0.0,0.0,0.0,0.0
1624.wav," However, the uncle may simply take the cost and add some additional amount on top",0.0,0.33333334,0.0,0.0,0.0,0.0,0.0
1625.wav, In this case he might just produce here or here,-0.33333334,0.33333334,0.0,0.33333334,0.0,0.0,0.0
1626.wav,I think it's a great opportunity for Africa to benefit from the next year's event.,2.0,1.0,0.0,0.0,0.0,0.0,0.0
1627.wav,"And I expect that in terms of economic benefit, that is should be able to inspire the regional countries nearby the South African.",0.33333334,0.33333334,0.0,0.0,0.0,0.0,0.0
1628.wav,"GBDA, Global Business and Digital Arts, my program",1.0,0.33333334,0.0,0.0,0.0,0.0,0.0
1629.wav,"And I knew that if I decided to go to the UK, that my term would be cut short so I would have to find an alternate route",-0.33333334,0.0,0.33333334,0.0,0.0,0.0,0.0
1630.wav,"Being in Europe and loving Europe so much, from my previous experiences of being there, I knew that I really wanted to stay",1.0,0.33333334,0.0,0.0,0.0,0.0,0.0
1631.wav,So that was something that I definitely had to plan out,-0.6666667,0.0,0.0,0.33333334,0.6666667,0.0,0.33333334
1632.wav,Apply to with Waterloo International before going to the UK,0.0,0.0,1.0,0.0,0.33333334,0.0,0.0
1633.wav,"I didn't really expect to go on the second study abroad just because my academic advisor kind of, veered towards, not going",0.0,0.0,0.0,0.0,0.0,0.0,0.0
1634.wav,"Hi, I’m Jack Canfield, co-creator of “Chicken Soup for the Soul” book series, and director of Canfield Training Institute.",0.0,1.0,0.0,0.0,0.0,0.0,0.0
1635.wav,I am here to recommend to you Hale Dwoskin and The Sedona Method.,1.0,0.6666667,0.0,0.0,0.0,0.0,0.0
1636.wav,"So if you want to take your life to a new level of inner peace, of joy, of effortless manifestation, then check out the Sedona Method, and check out Hale Dwoskin.",1.3333334,1.3333334,0.0,0.0,0.0,0.0,0.0
1637.wav,"He’s got a process literally that can teach you in a day how to release the negative energy, the negative feelings, the discomfort, the pain.",2.3333333,1.6666666,0.0,0.0,0.0,0.0,0.0
1638.wav,"He even actually cured me of a cold one night, he called and said I hear you got cold and I said yeah, he said you want to released it?",1.6666666,2.0,0.0,0.0,0.33333334,0.0,0.33333334
1639.wav,"This is Governor Steve Beshear ... About Kentucky I recently made my sixth visit to the BIO international convention where I met with high-tech startups, bioscience and healthcare entrepreneurs.",0.6666667,0.0,0.0,1.0,0.0,0.0,0.0
1640.wav,These innovative products and services will not only supercharge our economy but may even change the way we live.,1.6666666,0.33333334,0.0,0.0,0.0,0.0,0.0
1641.wav,Studies show that entrepreneurs like these are helping drive the economy in Kentucky.,0.33333334,0.0,0.0,0.6666667,0.0,0.0,0.0
1642.wav,This success is due to our ongoing commitment to support entrepreneurs with innovative products and services in order to keep Kentucky's economy on the right track.,2.0,0.33333334,0.0,0.0,0.0,0.0,0.0
1643.wav,"One reason for our success is our support of Kentucky's small high-tech businesses, and those willing to relocate in Kentucky, as they explore the potential of their technology and the ability to commercialize it.",1.3333334,0.33333334,0.0,0.6666667,0.0,0.0,0.0
1644.wav,Our SBIR-STTR program matches federal awards and is the most comprehensive of its type in the nation.,1.0,0.0,0.0,0.0,0.0,0.0,0.0
1645.wav,"To date, 154 grants to 74 companies for more than $37 million in matching dollars have been awarded.",0.33333334,0.33333334,0.0,1.0,0.0,0.0,0.0
1646.wav,"LAWRENCE GRANDPRE: I'm Lawrence Grandpre, from Leaders of a Beautiful Struggle.",0.0,0.0,0.33333334,0.0,0.0,0.0,0.0
1647.wav,"I do think the strike pattern of the defense, though, is the big story of the jury selection, while the defense--or the prosecution, excuse me, used their strikes on a diversity of folks, the defense only used their strikes on black folks, predominantly younger black folks.",-1.0,0.0,0.33333334,0.6666667,0.0,0.33333334,0.0
1648.wav,"NOOR: And the prosecution alleges that Freddie Gray said he couldn't breathe, and William Porter the defendant failed to do his duty as an officer to provide medical care.",-0.6666667,0.0,0.33333334,0.6666667,0.0,0.33333334,0.0
1649.wav,And therefore the prosecution's arguing the jury should convict him.,0.0,0.0,0.0,0.6666667,0.0,0.0,0.0
1650.wav,"GRANDPRE: Well, the opening statement started off pretty technical, explaining some of the nuances of the Baltimore Police Department.",0.0,0.0,0.0,0.0,0.0,0.0,0.0
1651.wav,"But it ended pretty strong in terms of the prosecution claiming that the defendant had multiple opportunities to intervene in that situation, where Freddie Gray had clearly severely diminished physical capacities, as explained by a broken neck that the defense claimed was sustained in the van.",-0.6666667,0.0,0.33333334,0.6666667,0.0,0.33333334,0.0
1652.wav,"Now, claiming that leads to a conviction not of murder but of manslaughter.",-0.6666667,0.0,0.0,1.0,0.0,0.0,0.0
1653.wav,"I think the big question is what tack is the defense going to take in terms of this particular defense and how their arguments in this case relate to a trial, a trial series that has six different cases, all with potentially conflicting and interrelated facts and stories to be told.",-0.33333334,0.0,0.33333334,0.33333334,0.33333334,0.0,0.0
1654.wav,"That's the big question is, what is the defense going to say, and what the defense says about Porter going to interact with all six trials being presented.",0.0,0.0,0.0,1.0,0.0,0.0,0.0
1655.wav,The defense actually used all six of their strikes on black people.,-1.3333334,0.0,0.33333334,1.0,0.0,1.0,0.0
1656.wav,"Now, the actual demographic from the jury represented Baltimore.",0.0,0.0,0.0,0.6666667,0.0,0.0,0.0
1657.wav,We obviously don't know any of the details of the individuals in particular.,0.0,0.33333334,0.33333334,0.0,0.0,0.0,0.0
1658.wav,"I mean these types of partnerships they start early on, and it's just casual mentorships in some ways or just in communications and they can evolve into being a part of a team, but early on getting that feedback gives you some ... a real reality check.",1.0,0.6666667,0.33333334,0.0,0.33333334,0.0,0.0
1659.wav,"If you start without an entity for the business, then when you have an entity it starts getting confusing about did I pay for that out of my own check book, did I pay for that out of the business, and reconciling the two is very frustrating even if it's only a month of an overlap time.",-0.6666667,0.0,0.0,0.0,0.0,0.33333334,0.0
1660.wav,"If you pay for a lot of things out of your own pocket, you really have no visibility there.",-0.6666667,0.33333334,0.33333334,0.0,0.0,0.0,0.0
1661.wav,"So, do you want to spend the money on protecting yourself to no end or do you want to spend your time and money on just developing something to show for yourself and my suggestion perhaps is that you'll know when you have to trademark and patent stuff, I mean it will be clear to you that well someone's interested in what I'm doing, so I better protect it.",1.0,0.6666667,0.33333334,0.0,0.0,0.0,0.6666667
1662.wav,"Until then, I mean it's just my opinion is, may be you should hold off and then trying to get a few other people who are passionate about what you're doing and this doesn't mean you should hire employees right away, but you should reach out to people that have similar interests and pass this idea by them and see if they show some resonance with the idea and some interest in being involved.",1.0,1.6666666,0.33333334,0.0,0.0,0.0,0.6666667
1663.wav,"And, the cash is important, right, because it's what allows students to pay back their student loans that they had to take out for degree completion to begin with",0.33333334,0.0,0.0,0.0,0.0,0.0,0.0
1664.wav,This is a definition of success that the media often is telling to students,0.33333334,0.0,0.0,0.0,0.0,0.33333334,0.0
1665.wav,"It included being holistic, academic components, personal components, life-skills, competencies",1.6666666,0.33333334,0.0,0.0,0.0,0.0,0.0
1666.wav,"How hard should your Rollga be? Should it be soft? Should it be very firm? There's a few things to this, number one if you go and ask a massage therapist to give you a soft, theaputic, circulatory type massage, you are going to go with something lower on the charts like your MalaPearl, something more soft",0.0,0.0,0.0,0.0,0.0,0.0,0.0
1667.wav," If you are going to be more aggressive and you go into the massage therapist and say, ""I want a sports massage, use your elbows, really dig into the tissue",0.33333334,0.0,0.0,0.0,0.0,0.0,0.0
1668.wav,""" Then you are going to go ahead and look into something more firm and aggressive like the Pro Series",0.0,0.6666667,0.0,0.0,0.0,0.0,0.0
1669.wav," Now there are some inbetween there, and I put together a nice little chart to help you decide which density is best for you",0.0,0.0,0.0,0.0,0.0,0.0,0.0
1670.wav, But there's also some other things to think about,0.0,0.0,0.0,0.0,0.33333334,0.0,0.0
1671.wav," If you are somebody that is just sitting on a chair using the Rollga, you are going to want something a little more firm, or if you are using the wall, technically if you are leaning against a wall you are going to want more pressure because you are using less body weight",0.33333334,1.0,0.0,0.0,0.0,0.0,0.0
1672.wav, Now if you are new to foam rolling I would suggest starting with something more soft and progressing your way up to something more firm,0.33333334,0.6666667,0.0,0.0,0.0,0.0,0.0
1673.wav," Some also like to use a soft Rollga for sensitive and tender areas, and they like to use something a little bit more firm to be a little bit more aggressive in others",0.6666667,0.0,0.0,0.0,0.0,0.0,0.0
1674.wav,"Rhett Reiger, White Caspian Studios, on behalf of Expert Village.",0.33333334,0.0,0.0,0.0,0.0,0.0,0.0
1675.wav,"You, I would highly recommend you go to story boards, you go to shot lists, because those are going to become great benefits to your movie in terms of saving money.",1.0,0.33333334,0.0,0.0,0.0,0.0,0.0
1676.wav,"So you need to know who those characters are, and of course you've got to know your locations because that's what people are going to see in your movie.",0.0,0.0,0.6666667,0.0,0.0,0.0,0.6666667
1677.wav,So there's got to be a fine balance between telling them what to do and letting them have some creative freedom.,0.33333334,0.0,0.0,0.0,0.0,0.0,0.0
1678.wav,Often times the director gets most of the glory too so it's a give and take.,0.33333334,0.0,0.0,0.0,0.0,0.0,0.0
1679.wav,"So important that you organize, that you plan, that you work with the crew, you work with the cast, if you can hand pick them great.",1.0,0.33333334,0.6666667,0.0,0.0,0.0,0.0
1680.wav,"A lot of us have, and all I can say is if it weren't for loans, I wouldn't be here.",1.0,0.33333334,0.0,0.0,0.0,0.0,0.0
1681.wav,"And if you find yourself unable to make your payments, don't let it slide.",0.33333334,0.0,0.0,0.0,0.0,0.0,0.0
1682.wav,There are a lot of options available to you when you need a little relief.,1.0,0.0,0.0,0.0,0.0,0.0,0.0
1683.wav,"Here's a list: They may be able to temporarily reduce or suspend payments, or allow you to make payments based on your income.",0.33333334,0.33333334,0.0,0.0,0.0,0.0,0.0
1684.wav,"But defaulting on student loan obligations could have some very painful consequences, such as: incurring damage to your credit score, having to deal with a collection agency, being forced to pay a percentage of your income, having your Social Security benefits withheld, becoming ineligible for future federal loans, and/or losing deferment options.",-0.6666667,0.0,0.0,0.0,0.0,0.0,0.0
1685.wav,"So if you've got student loans, make them a priority in your life after school.",0.0,0.0,0.33333334,0.33333334,0.0,0.0,0.0
1686.wav,The time is soon coming when I'll have to be paying them back.,0.0,0.6666667,0.0,0.0,0.0,0.0,0.0
1687.wav,"With some of these options, you pay a fixed amount every month.",0.0,0.0,0.0,0.0,0.0,0.0,0.0
1688.wav,Other options allow your monthly payments to increase as your income does.,0.6666667,0.6666667,0.0,0.0,0.0,0.0,0.33333334
1689.wav,Just go to www.studentaid.ed.gov and look for “public service loan forgiveness” to learn more.,1.0,0.6666667,0.0,0.0,0.0,0.0,0.0
1690.wav,coming up when we go on our trip and the van cannot smell like it does now for that 18-hour trip,0.6666667,1.3333334,0.0,0.0,0.0,0.0,0.0
1691.wav,"So we're trying to clean it out, get it smelling good, and then we're gonna go eat dinner",1.0,1.0,0.0,0.0,0.0,0.0,0.0
1692.wav,"My heart was just really grateful for that opportunity to say ""hello"" and we were running late, as always, but I was grateful that I took that chance",2.3333333,2.3333333,0.0,0.0,0.33333334,0.0,0.0
1693.wav,"potential customers, and other businesses",0.0,0.0,0.0,0.0,0.0,0.0,0.0
1694.wav,Schools are getting connected with one another,0.0,0.0,0.0,0.0,0.0,0.0,0.0
1695.wav,Non-profit organization are connecting their communities together,0.33333334,0.0,0.0,0.0,0.0,0.0,0.0
1696.wav,Networking has become so important that it has integrated into face-to-face conversations,0.6666667,0.0,0.0,0.0,0.0,0.0,0.0
1697.wav,"People have come to talk about what one posts on ""X"" networks or on ""X"" site",0.0,0.0,0.0,0.0,0.0,0.0,0.0
1698.wav,Such conversations have sparked the attention of many people,0.0,0.0,0.0,0.0,0.0,0.0,0.0
1699.wav,The teaching assistantship that I undertook  lasted for nine months I was working in what's the  equivalent a sixth form  college.,0.0,0.0,0.0,0.0,0.0,0.0,1.0
1700.wav,"In terms of the activities which I took part in there was lots of things, ranging from sorts of  oral classes, to presentations about English  culture and informing about English culture in general and  it also I often had to  participate in lessons, and plan  lessons for the school and it was a brilliant experience.",1.0,0.0,0.0,0.0,0.0,0.0,1.0
1701.wav,"In terms of finance I  received  the Aramis  funding, Aramis  grant which you're entitled to as a teaching assistantship as well as the student  and that really helped me out through the year.",1.3333334,0.0,0.0,0.0,0.0,0.0,0.0
1702.wav,"As well as receiving  a generous bursary from the AAD the equivalent to British Council in Germany and basically I set up for the year in it really helped make my year, and something  to remember to be quite honest.",0.33333334,0.33333334,0.0,0.0,0.33333334,0.0,0.0
1703.wav,"Last night, the IDF and the ISA put dozens of Hamas terrorists back in prison including some who were released in the framework of the agreement to return Gilad Shalit.",0.0,0.0,0.33333334,0.0,0.0,0.0,0.0
1704.wav,"I praise the soldiers and commanders -- from the IDF, ISA and the Israel Police.",-0.33333334,0.0,0.0,0.0,0.0,0.0,0.0
1705.wav,"As soon as the Cabinet made its decision, they successfully carried out this complicated mission in less than a day.",0.0,0.33333334,0.6666667,1.0,0.0,0.0,0.0
1706.wav,"It will yet include many actions against the terrorists that attack, murder and kidnap Israeli citizens and want to destroy the State of Israel.",0.0,0.0,0.0,1.3333334,0.0,0.6666667,0.0
1707.wav,"We are fighting terrorism and Hamas will continue to pay a heavy price for abducting Eyal, Gilad and Naftali, the three youths who were on their way home to their parents.",0.0,0.0,0.6666667,1.0,0.0,0.33333334,0.0
1708.wav,"FEMALE SPEAKER: Bad advertising isn't memorable, isn't meaningful.",-1.3333334,0.0,0.0,0.0,0.0,0.6666667,0.0
1709.wav,FEMALE SPEAKER: This is Domino Pizza advertisement I don't like.,-1.6666666,0.0,0.0,0.0,0.0,0.6666667,0.0
1710.wav,"I see that everywhere for some reason, especially on the trains.",0.0,0.0,0.33333334,0.0,0.0,0.33333334,0.0
1711.wav,"MALE SPEAKER: Bad advertising, first of all, is spam email.",-1.3333334,0.0,0.0,0.33333334,0.0,0.6666667,0.0
1712.wav,"Hi My name is Desiree Dorsey and I'm going to read a monologue from--a quote from Tom Robbins So you think that you're a failure, do you?",0.33333334,0.6666667,0.0,0.0,0.0,0.0,1.3333334
1713.wav,A mediocre failure is as insufferable as a mediocre success embrace failure!,-0.6666667,0.0,0.33333334,0.6666667,0.0,0.33333334,0.0
1714.wav,"Now take a small, sharp cutting knife, be careful of your fingers, and we are gonna filet our olives",1.3333334,2.3333333,0.0,0.0,0.0,0.0,0.0
1715.wav,"This is so funny, we’re gonna cut out the meat of the olive, by keeping the knife nice and flat and sliding it through",2.0,2.0,0.0,0.0,0.0,0.0,0.0
1716.wav,"We have ready our olive decorations, and now, we are gonna cut the cheese",1.0,1.6666666,0.0,0.0,0.0,0.0,0.0
1717.wav,"So you’re gonna take your white cheese, I’m using provolone, take your #2A Tip and we’re gonna cut out a bunch of circles, every bird will need 2",1.3333334,1.3333334,0.0,0.0,0.0,0.0,0.0
1718.wav,"Just be really careful, don’t get your fingers",1.3333334,2.3333333,0.0,0.0,0.0,0.0,0.0
1719.wav,"I’m 5 years old, I love doing this",3.0,3.0,0.0,0.0,0.0,0.0,0.0
1720.wav,"Now we are going to cut our olives into thin strips, we will need 5 strips for each bird",0.33333334,1.6666666,0.0,0.0,0.6666667,0.0,0.0
1721.wav,I’m gonna be cutting strips into about 1/2 of my olives and I’m gonna be saving the other 1/2 for my eye decorations,1.0,1.0,0.0,0.0,0.0,0.0,0.0
1722.wav,"Then you’re gonna take your 363 tip, and we’re gonna be cutting the pupils",0.0,1.6666666,0.0,0.0,0.0,0.0,0.0
1723.wav,"Remember, each bird will need 2 of them",2.0,2.0,0.0,0.0,0.0,0.0,0.0
1724.wav,Here's a summary of what we learned so far about finding a monologue and beginning rehearsing with it.,0.0,0.33333334,0.0,0.0,0.0,0.0,0.0
1725.wav,"I'm Burns Phillips, commissioner of the Department of Labor and Workforce Development.",0.16666667,0.16666667,0.0,0.0,0.0,0.0,0.0
1726.wav,Two years ago we began a journey to completely overhaul Tennessee's forty year old unemployment insurance system so that we might improve our serve employers and deliver unemployment benefits to claimants.,0.0,0.0,0.0,0.0,0.0,0.0,0.0
1727.wav,We're working around the clock to make sure to smooth transition.,0.5,0.33333334,0.0,0.33333334,0.0,0.0,0.0
1728.wav, We're excited about these changes and a chance to give us to serve you better.,0.33333334,0.0,0.0,0.0,0.0,0.0,0.0
1729.wav,The new system or run through the Job4TN.gov website.,0.0,0.0,0.0,0.0,0.0,0.0,0.0
1730.wav,"Soon you'll be able to go online and handle your claimant responses, as well as any protest or appeals processes.",0.33333334,0.33333334,0.0,1.0,0.0,0.0,0.0
1731.wav,Now your company will have to register with Jobs4TN.gov in order to use this new system.,0.6666667,0.0,0.16666667,0.6666667,0.0,0.0,0.0
1732.wav,Rest assured we've taken many safeguards to keep your information confidential.,0.0,0.0,0.0,0.0,0.0,0.0,0.0
1733.wav,Another change will impact companies who have employees on partial layoff.,0.16666667,0.0,0.0,0.0,0.16666667,0.0,0.0
1734.wav,Those employees will need to register at Jobs4TN.gov and go online each week to certify that they are still out of work.,0.5,0.0,0.0,0.16666667,0.0,0.0,0.0
1735.wav,"Now, that's a change it will take some getting used to, but we're here to help through all this.",0.33333334,0.0,0.0,0.33333334,0.0,0.0,0.0
1736.wav,"That was really no decision at all for me, I think I was maybe born a democrat.",0.33333334,0.33333334,0.0,0.0,0.0,0.0,0.0
1737.wav,"One of the key values to me that has always driven, what I like to think has driven what I do, is working for the common good, and that to me really is a definition of a democrat, and differentiates democrats from other political parties, or particularly from republicans.",1.0,0.6666667,0.0,0.0,0.0,0.0,0.0
1738.wav,"And what that means to me is that we're all in this together, and what we do as a society and as a community we need to look at how that affects everybody, not just the winners or the people who already have, we need to look at the have nots and we also need to look at the fact that paying our taxes and having a government that supports and protects all of us is good for everyone.",0.33333334,0.0,0.0,0.0,0.0,0.0,1.0
1739.wav,"If you cross the line, one school has very little money, and overcrowded schools have crumbling structure, and another school has a beautiful new gym, well paid teachers, and kids who 90 percent of them go onto college.",-1.3333334,0.0,1.0,0.6666667,0.0,1.0,0.33333334
1740.wav,"- [Announcer] And now, a Citizens National Bank Newsletter Extra",0.0,0.0,0.0,0.0,0.0,0.0,0.0
1741.wav," - Citizens National Bank has always offered Farm Service Agency guaranteed lending, but recently we became a preferred lender with them, which allows us to speed up the approval process",0.0,0.0,0.0,0.0,0.0,0.0,0.0
1742.wav," Other than the Farm Service Agency loan programs, other options that we have started or are involved with would be through the Farmer Mac Program",0.0,0.0,0.0,0.0,0.0,0.0,0.0
1743.wav, They basically have two,0.0,0.0,0.0,0.0,0.0,0.0,0.0
1744.wav," There's a Farmer Mac Two which coincides with the Farm Service Agency, that'll give us a fixed rate on their program",0.33333334,0.33333334,0.0,0.0,0.0,0.0,0.0
1745.wav, They also offer a Farmer Mac One,0.0,0.0,0.0,0.0,0.0,0.0,0.0
1746.wav," And the Farmer Mac One is available to any borrower and even if you are a investor owning property and you want to have an option of having a fixed rate on your real estate, we can take you through the Farmer Mac One program and lock that rate in",0.0,0.0,0.0,0.0,0.0,0.0,0.0
1747.wav, Another option that we have through the Farm Service Agency is the Beginning Farmer program,0.33333334,0.33333334,0.0,0.0,0.0,0.0,0.0
1748.wav, And this really allows for a family farm operation to transition real estate from one generation to the next,0.0,0.0,0.0,0.0,0.0,0.0,0.0
1749.wav, The way this works or the structure would be that the bank would finance 50% of the deal on our normal terms,0.0,0.0,0.0,0.0,0.0,0.0,0.0
1750.wav, Farm Service Agency's portion would be financed for 20 years and currently the rate on that would be 1,0.0,0.0,0.0,0.0,0.0,0.0,0.0
1751.wav," Prior to that, it took us thirty days for an approval through the FSA, but now we can do it in four days",0.0,0.0,0.0,0.0,0.0,0.0,0.0
1752.wav, The borrower then needs to come up with 5% or have a 5% injection into the process,0.0,0.0,0.0,0.0,0.0,0.0,0.0
1753.wav," The loan limit with the Farm Service Agency is $225,000",0.0,0.0,0.0,0.0,0.0,0.0,0.0
1754.wav, And the balance of it then can be done with bank funding,0.0,0.0,0.0,0.0,0.0,0.0,0.0
1755.wav," To learn more about these programs, visit our Farm Services under the business section of this website",0.0,0.0,0.0,0.0,0.0,0.0,0.0
1756.wav," Or you can give one of us a call at any of the branches that we have, or stop in and see us",0.33333334,0.33333334,0.0,0.0,0.0,0.0,0.0
1757.wav, - [Announcer] Thanks for watching our Newsletter Extra,0.33333334,0.0,0.0,0.0,0.0,0.0,0.0
1758.wav, What we're required to submit now is a one page application and a narrative,0.0,0.0,0.0,0.0,0.0,0.0,0.0
1759.wav," If we can get two or three years of annual statements, that would be great",0.0,0.0,0.0,0.0,0.0,0.0,0.0
1760.wav," Three years of tax returns, so we can kind of average out what the income numbers are",0.6666667,0.0,0.0,0.0,0.0,0.0,0.0
1761.wav," And the different types of loans that we can offer with this are Farm Ownership loans, Operating lines of credit, or Equipment and Capital Improvement needs loans",0.0,0.0,0.0,0.0,0.0,0.0,0.0
1762.wav," The benefit to the borrower also allows us on the real estate transactions to offer them a long term real estate loan that's fixed on the rate, different terms that we have now, we can fix a rate up to thirty years",1.0,0.0,0.0,0.0,0.0,0.0,0.0
1763.wav," Where prior to that, typically, we'd lock a rate in for a borrower for five years",0.0,0.0,0.0,0.0,0.0,0.0,0.0
1764.wav," You know the benefit to that would be that they can mitigate any interest rate risk by locking in and knowing where their payments will be for ten, fifteen, twenty, twenty-five years up to thirty",0.0,0.0,0.0,0.0,0.0,0.0,0.0
1765.wav,"a sigh, nor a thought tainted with the slightest flavor of unhappiness or discontent",0.0,0.0,0.0,0.0,0.0,0.0,0.0
1766.wav,"All our wishes are gratified, and love reigns eternally and without stint",0.33333334,0.33333334,0.0,0.0,0.0,0.0,0.0
