file_name,text,sentiment,happy,sad,anger,surprise,disgust,fear
698.wav,It was less clear what her strategy was in the second debate,-1.3333334,0.0,0.0,0.0,0.0,0.0,0.0
699.wav,"I'm well aware of that, being a former Attorney General myself from Ohio.",0.0,0.33333334,0.0,0.0,0.0,0.0,0.0
700.wav,"This is a Sun Oven, it folds up it carries like a suitcase and only weighs 21 pounds",0.6666667,0.6666667,0.0,0.0,0.0,0.0,0.0
701.wav,Where happiness comes from: genes plus environment,0.0,0.6666667,0.0,0.0,0.0,0.0,0.0
702.wav,You could not even distinguish which group they were in based on that metric,-0.6666667,0.0,0.0,0.0,0.0,0.0,0.0
703.wav,This week I wanted to recommend to you a brand new science-fiction book published in 2015,1.3333334,1.3333334,0.0,0.0,0.0,0.0,0.0
704.wav,"So, hopefully that doesn't bite you in the ass, you guys, because the whole game is basically an online ESport",-1.0,0.6666667,0.33333334,0.0,0.33333334,0.33333334,0.33333334
705.wav,"And so when I look at what we're doing now, I feel like we have blended those very nicely.",1.0,0.6666667,0.0,0.0,0.0,0.0,0.0
706.wav,"Joining us now from Kansas City, Missouri, to discuss all of this is Bill Black",0.33333334,1.3333334,0.0,0.0,0.0,0.0,0.0
707.wav,"Thank you for joining us again, Bill--twice this week",1.3333334,1.0,0.0,0.0,0.0,0.0,0.0
708.wav,You can even start at young age or no matter how old you are.,1.6666666,2.0,0.0,0.0,0.0,0.0,0.0
709.wav, These are the West Announcements,0.6666667,0.6666667,0.0,0.0,0.33333334,0.0,0.0
710.wav, With the lead down to 2 and,0.33333334,1.3333334,0.0,0.0,0.0,0.0,0.0
711.wav, Now back to the studio,0.0,0.0,0.0,0.0,0.0,0.0,0.0
712.wav," There will be games, snacks, fun and, of course, time for your favorite books",1.0,0.6666667,0.0,0.0,0.0,0.0,0.0
713.wav, Now to Caleb in sports,0.6666667,0.6666667,0.0,0.0,0.0,0.0,0.0
714.wav, Does it flow well? Are you discussing all of the subject areas that pertain to your clients financial situation,0.0,0.0,0.0,0.0,0.0,0.0,0.0
715.wav,It helps them from the inception of the business... and throughout the entire lifetime of the business.,0.6666667,1.6666666,0.0,0.0,0.0,0.0,0.0
716.wav,There's never a dull moment in the practice of corporate law.,1.3333334,0.33333334,0.0,0.0,0.0,0.0,0.0
717.wav,and the desegregation of the buses,-0.6666667,0.0,1.0,0.0,0.0,0.0,0.0
718.wav,All of those things we fight for in rules and regulations in the Department of Transportation,0.0,0.0,0.0,0.0,0.0,0.0,0.0
719.wav," They do, y'all do a great job",2.3333333,0.0,0.0,0.0,0.0,0.0,0.0
720.wav, One of the future of our company,1.3333334,1.3333334,0.0,0.0,0.0,0.0,0.0
721.wav, But I'm here at on UNCC,0.0,0.33333334,0.0,0.0,0.0,0.0,0.0
722.wav," I've been coming, I think this is my fifth year, doing this fair",0.0,0.0,0.0,0.0,0.0,0.0,0.0
723.wav,"And don’t forget the places need to be all over the world, so not just in Germany.",1.0,2.6666667,0.0,0.0,0.0,0.0,0.0
724.wav,Thanks so much for watching and thank you all so much for the support you've given me to get here.,1.3333334,1.6666666,0.0,0.0,0.0,0.0,0.0
725.wav,We have taken steps to support those who have concerns and report them with a new Office of Dispute Resolution and improved complaint procedures.,0.6666667,0.33333334,0.6666667,0.33333334,0.0,0.0,0.33333334
726.wav,"Rather than do so, he resigned more than a year before the end date of his contract.",-0.33333334,0.0,0.0,0.0,0.0,0.0,0.0
727.wav,9 percent lower than December's reading of 53,0.0,1.0,0.0,0.0,0.33333334,0.0,0.0
728.wav,There's no barriers and this is something that's very exciting.,1.6666666,1.6666666,0.0,0.0,0.0,0.0,0.0
729.wav,"They can provide real time reporting, so that the advertiser can adjust based upon the consumer engagement.",0.0,0.0,0.6666667,0.0,0.0,0.0,0.0
730.wav,In the next section you'll see some common resume structures.,0.0,0.6666667,0.0,0.0,0.0,0.0,0.0
731.wav,"Based on this information, fill out your targeted resume and see which order communicates your goals and experience most clearly.",0.33333334,0.33333334,0.0,0.0,0.0,0.0,0.0
732.wav,"and then made a second trip to Idomeni, at the Greek-Macedonian border to work with the refugees",0.0,0.0,0.0,0.0,0.0,0.0,0.0
733.wav,""" ""Yalla"" is a word that we heard in almost every sentence",-0.6666667,0.0,0.6666667,0.33333334,0.0,0.33333334,0.0
734.wav,And ultimately they start to take on some bills and responsibilities of their own.,0.0,0.33333334,0.0,0.0,0.0,0.0,0.0
735.wav,"Again, ""I would love it if",1.0,1.0,0.0,0.33333334,0.6666667,0.0,0.0
736.wav,""" That is a terrible way to start a persuasive sentence",-0.33333334,0.33333334,0.0,0.0,0.6666667,0.33333334,0.0
737.wav,Greetings! I am Tom Earl,1.3333334,2.6666667,0.0,0.0,0.0,0.0,0.0
738.wav, And amazing moments I get to witness and be a part of,2.3333333,2.3333333,0.0,0.0,0.0,0.0,0.0
739.wav, You say out loud: one thing you're grateful for,2.3333333,3.0,0.0,0.0,0.0,0.0,0.0
740.wav, Make it a practice,1.0,2.3333333,0.0,0.0,0.0,0.0,0.0
741.wav,Van Alderman here with Prospect Equity Group and I want to take some time to tell you a little bit about our company and what it is we do.,0.33333334,1.0,0.0,0.0,0.0,0.0,0.0
742.wav,We would love to speak to you.,1.0,0.6666667,0.0,0.0,0.0,0.0,0.0
743.wav,And our process is extremely simple.,0.6666667,0.6666667,0.0,0.0,0.0,0.0,0.0
744.wav,Filed it away in certain categories and now we have to remember it.,-0.33333334,0.33333334,0.0,0.33333334,0.0,0.0,0.0
745.wav,It also has the sense of respected,0.33333334,0.0,0.6666667,0.0,0.0,0.0,0.0
746.wav,Let's assume the retailer pays a 3% fee in order to be able to accept Visa cards.,0.0,0.33333334,0.33333334,0.0,0.0,0.0,0.0
747.wav,"Hi You guys, it's Laura here from www.womens-fitness-tips.com.",2.0,2.3333333,0.0,0.0,0.0,0.0,0.0
748.wav,"The first ever video uploaded to YouTube was called “Me at the Zoo” and shows YouTube cofounder, Jawed Karim, talking about the long trunks of elephants",1.3333334,1.3333334,0.0,0.0,1.0,0.0,0.0
749.wav,Carl noted that was actually a waste of time for this minimum viable product.,-0.6666667,0.0,0.0,0.0,0.0,0.0,0.0
750.wav,"As an entrepreneur, you have to make sure that your team isn't introducing scope creep.",0.0,0.6666667,0.0,0.0,0.0,0.0,0.0
751.wav,"From a political perspective, we've got disarray in the Conservative Party in Britain, and in the Labor Party.",-1.0,0.0,0.33333334,0.0,0.0,0.33333334,0.0
752.wav,"You know, for 30 years there's been suffocation in these debates",-0.6666667,0.0,0.0,0.6666667,0.0,0.0,0.0
753.wav,"If they want to have a Day of Dialogue, I say we make it a Rational Day of Dialogue.",0.33333334,0.33333334,0.0,0.0,0.0,0.0,0.0
754.wav,Students should know the truth behind these religious claims: they're not as unquestionable as they might seem.,-0.6666667,0.0,0.0,0.33333334,0.0,0.0,0.0
755.wav,"But if a dialogue is what they're after, maybe that's just what we need.",0.0,0.33333334,0.0,0.0,0.0,0.0,0.0
756.wav,I'm going to talk to you today about how to become a social worker.,0.0,0.0,0.6666667,0.33333334,0.0,0.0,0.0
757.wav,Please note that this is meant to just be for occasional shoulder discomfort,-0.33333334,0.0,0.33333334,0.0,0.0,0.0,0.0
758.wav,"So first up, let's take a brief look at the shoulder",0.0,0.6666667,0.0,0.0,0.0,0.0,0.0
759.wav,The shoulder is made up of three parts,0.6666667,0.33333334,0.0,0.0,0.0,0.0,0.0
760.wav,"Such as if they told you to apply online, make sure you do that.",0.0,0.0,0.0,0.0,0.0,0.0,0.0
761.wav,For the last four years I've been teaching English through the internet with the company in Taiwan and I was pretty much in a rut.,-0.6666667,0.0,0.6666667,0.0,0.0,0.0,0.0
762.wav,"Okay, we're working on our cutting for our humorous interpretation.",0.33333334,0.33333334,0.0,0.0,0.0,0.0,0.0
763.wav,Regular investors have always been locked out of early-stage company investments until now.,0.33333334,0.0,0.0,0.0,0.0,0.0,0.0
764.wav,This is Patrick Munro talking about the benefits of overall financing.,1.0,0.33333334,0.0,0.0,0.0,0.0,0.0
765.wav,"Means that, we feel safer, more cared for and more able to trust people",0.33333334,0.0,0.0,0.0,0.0,0.0,0.0
766.wav,I think those are some of the things you should be thinking about in order to get close to the investors.,0.33333334,0.0,0.6666667,0.0,0.0,0.0,0.0
767.wav,hey guys welcome back to my channel FearlessRN,1.3333334,2.3333333,0.0,0.0,0.0,0.0,0.0
768.wav," Another thing I would suggest is, elimination",0.0,0.0,0.0,0.0,0.0,0.0,0.0
769.wav, The next thing you should know is to look in detail at the side effects of the drugs,1.0,1.0,0.0,0.0,0.0,0.0,0.0
770.wav, We want money out of politics,0.33333334,0.6666667,0.0,0.0,0.33333334,0.0,0.0
771.wav, Most of us can vote,1.0,0.0,0.0,0.33333334,0.33333334,0.33333334,0.0
772.wav, I have no super PAC,-0.6666667,0.33333334,0.0,0.33333334,0.0,0.0,0.0
773.wav,But I've been afforded a lot of opportunities,1.6666666,2.3333333,0.0,0.0,0.0,0.0,0.0
774.wav, There's also tons of written content and lots of exercises to help you practice what you're learning,1.3333334,0.0,0.0,0.0,0.0,0.0,0.0
775.wav, This course is not just about learning the tarot,0.6666667,2.3333333,0.0,0.0,0.0,0.0,0.0
776.wav, It helps make it so much easier,2.0,2.0,0.0,0.0,0.0,0.0,0.0
777.wav,generic! I wanted accurate insights,0.6666667,2.3333333,0.0,0.0,0.0,0.0,0.0
778.wav, This is something anyone can learn to do,1.6666666,1.6666666,0.0,0.0,0.0,0.0,0.0
779.wav, So call us now (361) 814-3487 and see just how wonderful they are,2.0,1.3333334,0.0,0.0,0.0,0.0,0.0
780.wav, But that might actually be good news,0.33333334,0.33333334,0.16666667,0.0,0.5,0.33333334,0.0
781.wav," Both cases recently won major victories for equality, and now head separately to the 10th Circuit Court of Appeals",0.5,0.16666667,0.0,0.0,0.0,0.0,0.0
782.wav," If they rule promptly, both cases could go to the US Supreme Court in its next session",1.0,0.33333334,0.0,0.0,0.0,0.0,0.0
783.wav, Now Nevada Attorney General Katherine Cortez has announced that she will review the arguments made in a marriage case there,0.0,0.0,0.0,0.0,0.0,0.0,0.0
784.wav, Stay tuned for further announcements about our day in court,0.0,0.33333334,0.0,0.0,0.0,0.0,0.0
785.wav,"In my last video, I talked about finding a quick way to describe your company in relation to what the audience understands…and loves",1.3333334,1.0,0.0,0.0,0.0,0.0,0.0
786.wav,I just have one last thing to say and that's keep innovating.,1.0,0.0,0.0,0.0,0.0,0.0,0.0
787.wav,"And this has been Braden Kelley, author of Stoking Innovation Bonfire.",0.16666667,0.0,0.0,0.0,0.0,0.0,0.16666667
788.wav,"Hey guys, this is Richard with Short Term Rental Secrets",0.6666667,0.33333334,0.0,0.0,0.0,0.0,0.0
789.wav, Some of the adjectives that you might find are really helpful you won't know on day one,0.33333334,0.0,0.0,0.0,0.0,0.0,0.0
790.wav, We're filming content like this all the time and we really hope to see you soon,1.0,0.0,0.0,0.0,0.0,0.0,0.0
791.wav,"It's very hard, as far as marketing is concerned   there's a lot of noise out there.",0.0,0.0,0.0,0.0,0.0,0.0,0.0
792.wav,"Thanks for spending time with me at Frank Leutz, Desert Car Care.",2.0,1.3333334,0.33333334,0.0,0.0,0.0,0.0
793.wav,That's the general story structure shape,0.0,0.0,0.0,0.0,0.0,0.0,0.0
794.wav,But here's the shape of three act story structure,0.6666667,0.6666667,0.0,0.0,0.0,0.0,0.0
795.wav,This is the tool I want to give you,1.3333334,1.3333334,0.0,0.0,0.0,0.0,0.0
796.wav,I think this is incredibly cool,2.6666667,2.6666667,0.0,0.0,0.6666667,0.0,0.0
797.wav,"If the Phen375 were so wrong, why so many people would buy them?",1.0,1.0,0.0,0.0,0.6666667,0.0,0.0
798.wav,You will get one bottle free if you decide to buy three bottles at once.,1.0,2.3333333,0.0,0.0,0.0,0.0,0.0
799.wav,His humility: he lived as a carpenter had a simple life lived amongst the poor,0.33333334,0.0,0.0,0.0,0.0,0.0,0.0
800.wav, I think it's gonna be really great by the way,2.3333333,2.3333333,0.0,0.0,0.0,0.0,0.0
801.wav, You can find the link below,0.6666667,1.6666666,0.0,0.0,0.0,0.0,0.0
802.wav," I think, you'll have fun with it",1.3333334,2.3333333,0.0,0.0,0.0,0.0,0.0
803.wav, I hope you have a great rest of the day if you're watching this in the morning,2.6666667,2.6666667,0.0,0.0,0.0,0.0,0.0
804.wav, It's not a beginning course,0.33333334,0.6666667,0.0,0.0,0.0,0.33333334,0.0
805.wav,not yet resolving in the courts,0.0,0.0,0.0,0.0,0.0,0.0,0.0
806.wav,"” Political prison camps where, by UN estimates, between 80 and 120 thousand people are currently being held",-0.6666667,0.0,0.0,0.0,0.0,0.33333334,0.0
807.wav,"Welcome to our CFP exam page, and thank you for stopping by.",1.3333334,1.3333334,0.0,0.0,0.0,0.0,0.0
808.wav,My name is Jeremy Vreeken,0.0,1.0,0.0,0.0,0.0,0.0,0.0
809.wav, And then I went back home and looked for ways to do it too,0.0,0.0,1.0,0.0,0.0,0.33333334,0.0
810.wav,if I'm speaking to a political leader,0.33333334,1.0,0.0,0.0,0.0,0.0,0.0
811.wav," And you, as in the body that represents all government",0.0,0.0,0.33333334,0.0,0.0,0.0,0.33333334
812.wav," And, um, I think young people could be mobilized if they saw support for these issues",0.0,0.33333334,0.0,0.0,0.0,0.0,0.0
813.wav," And that, um, made me really sad",-1.0,0.0,0.6666667,0.0,0.0,0.0,0.0
814.wav,It actually causes it to last longer,0.6666667,0.6666667,0.0,0.0,0.0,0.0,0.0
815.wav,You're too young to be deaf,-1.3333334,0.0,1.6666666,0.6666667,0.0,0.0,0.0
816.wav,Every loan program and product today has a maximum debt-to-income ratio that's allowed.,0.0,0.33333334,0.0,0.33333334,0.33333334,0.0,0.0
817.wav,His program is OK because he is making me lose the championship.,-1.0,0.0,0.33333334,0.33333334,0.0,0.33333334,0.33333334
818.wav,"Through his reports back to the parliament, that makes the system overall much more accountable.",0.6666667,0.0,0.33333334,0.0,0.0,0.0,0.0
819.wav,I hope this video helped you,1.3333334,2.3333333,0.0,0.0,0.0,0.0,0.0
820.wav,First of all let's just real quickly define what we mean by the word equity.,0.0,0.33333334,0.0,0.0,0.0,0.0,0.0
821.wav,My name is Morgan McLellan and i just completed the eight week BuiltLean program.,1.6666666,1.3333334,0.0,0.0,0.0,0.0,0.0
822.wav,It'just a treasure trove of everything you need to know about health and fitness.,1.6666666,1.3333334,0.0,0.0,0.6666667,0.0,0.0
823.wav,This is another of my favorite albums,1.0,0.0,0.33333334,0.0,0.0,0.0,0.0
824.wav,So it sounds a little different,0.6666667,0.6666667,0.6666667,0.0,0.0,0.0,0.0
825.wav,""" This morning there was some sand under the climbing structure",0.0,0.33333334,0.0,0.0,0.0,0.0,0.0
826.wav,How come you didn't sweep,0.0,0.0,0.0,0.0,0.0,0.0,0.0
827.wav,""" And Cory could say, ""I had a had a late pick-up yesterday",1.0,1.0,0.0,0.0,0.0,0.0,0.0
828.wav,The children don't break things because they want to break them,1.0,1.0,0.0,0.0,0.0,0.0,0.0
829.wav,"Hey guys, this is Brodie Arldt",0.0,0.0,0.0,0.0,0.0,0.0,0.0
830.wav, At that moment my Pa-Paw knew I was something special,1.3333334,0.0,0.0,0.0,0.0,0.0,0.0
831.wav, There are many memories Pa-Paw and I would share,0.33333334,0.0,0.33333334,0.0,0.0,0.0,0.0
832.wav, I was always there right beside him and I was lucky to have him,1.3333334,0.0,0.0,0.33333334,0.0,0.0,0.0
833.wav, When I grew up I wanted to be just like him,1.3333334,0.0,0.0,0.0,0.0,0.0,0.0
834.wav," Everything I learned, I learned from my Pa-Paw",0.33333334,0.0,0.0,0.0,0.0,0.0,0.0
835.wav, Someday I hope to become half the man you were,0.33333334,0.0,1.0,0.0,0.0,0.0,0.0
836.wav, People like my Pa-Paw are one in a million,1.0,0.0,1.3333334,0.0,0.0,0.0,0.0
837.wav," In nineteen sixty-seven, he would have his second and last child, my mother, Cheryl Blaha",0.0,0.33333334,0.0,0.0,0.0,0.0,0.0
838.wav,"So when you want to show pictures, your computer is going to have to perform certain functions in order to get that picture displayed.",0.33333334,0.33333334,0.0,0.0,0.0,0.0,0.0
839.wav,Greater transparency&nbsp;in both how governments and businesses operate.,0.6666667,0.0,0.0,0.6666667,0.0,0.0,0.0
840.wav,"Since we're not carrying the flag of any one distribution method over another, we don't have a conflict of interest in what we recommend.",0.33333334,0.33333334,0.0,0.6666667,0.0,0.0,0.0
841.wav,Digitally is all about everyone being connected to everyone else in anything they're interested in.,1.0,1.3333334,0.0,0.0,0.0,0.0,0.0
842.wav,Anything that can be done digitally will start to be done digitally.,0.33333334,1.3333334,0.0,0.0,0.0,0.0,0.0
843.wav,The production hiatus lasted about a week,0.0,0.0,0.33333334,0.0,0.0,0.0,0.0
844.wav,Who knew that was possible in Hollywood,0.6666667,0.6666667,0.0,0.0,0.0,0.0,0.0
845.wav,the divorce was ultimately settled in June 2013,0.0,0.0,0.0,0.0,0.0,0.0,0.0
846.wav,That friendship might explain the delay,0.0,0.0,0.0,0.0,0.0,0.0,0.0
847.wav,"We were married for a long time, so it's not like we didn't try",-0.33333334,0.0,0.33333334,0.0,0.0,0.0,0.0
848.wav,"As you can tell from the gray speckled walls behind me, I am in an airport, and as you can tell from my cold dead eyes, it's 5:42 in the morning.",-1.3333334,0.6666667,0.33333334,0.33333334,0.0,0.0,0.33333334
849.wav,"Sadly that travel tip does not apply to people in Los Angeles, New York, Chicago, or Atlanta.",-1.0,0.33333334,0.0,0.6666667,0.0,0.0,0.0
850.wav,"Don't pay to go to the airport lounge, it's never worth it.",-2.3333333,0.0,0.33333334,1.6666666,0.0,0.6666667,0.0
851.wav,You think there's gonna be like milk and honey and beds in there.,-1.0,0.0,0.33333334,0.6666667,0.0,0.6666667,0.0
852.wav,"Almost every airport has a chapel, and they are always nice, and pleasant, and very quiet places.",1.3333334,2.0,0.0,0.33333334,0.0,0.0,0.0
853.wav,His job is very simple,-1.3333334,0.0,0.0,1.3333334,0.0,1.0,0.0
854.wav,Trump knows how to capture the hearts and minds of the audience especially if you don't even like him,1.3333334,1.6666666,0.0,0.0,0.33333334,0.0,0.0
855.wav, I would advise you to watch it now because YouTube may change their mind.,1.3333334,0.33333334,0.0,0.33333334,0.0,0.0,0.0
856.wav,"In fact, that's a lesson that many in of other parts of the world can learn as well.",0.0,0.0,0.0,0.0,0.0,0.0,0.33333334
857.wav,But make sure that you’re not so relaxed that you fall asleep,1.6666666,1.3333334,0.0,0.0,0.0,0.0,0.0
858.wav,You can achieve the perfect meditation posture by inhaling your shoulders up to your ears like so and exhaling your shoulder blades down along your spine,2.0,2.6666667,0.0,0.0,0.0,0.0,0.0
859.wav,"And even today, we see a white picket fence and we think success, self-possession",0.33333334,0.0,0.0,0.0,0.0,0.0,0.0
860.wav,And it's leading to a lot of exciting conversations and for us to look at opportunities that we never thought before possible.,3.0,2.0,0.0,0.0,0.6666667,0.0,0.0
861.wav,"I am doing spiritual practices during last Orthodox practices, based on spiritual prayers, Reiki.",1.6666666,2.3333333,0.0,0.0,0.0,0.0,0.0
862.wav,So when you're dealing with actors with egos there's got to be a lot of encouragement in order all the time.,-0.33333334,0.0,0.0,0.0,0.0,0.33333334,0.0
863.wav, We are here to visit with you about the current state of Hersey High School,1.0,1.0,0.0,0.0,0.0,0.0,0.0
864.wav, I would encourage you to keep your children focused on the rest of the semester,1.3333334,0.33333334,0.0,0.0,0.0,0.0,0.0
865.wav, We need to finish the semester as well as we can,0.33333334,0.33333334,0.0,0.0,0.0,0.0,0.0
866.wav, We have some outstanding efforts from our kids,2.6666667,0.6666667,0.0,0.0,0.0,0.0,0.0
867.wav, We offer so many things for so many kids,1.6666666,0.33333334,0.0,0.0,0.0,0.0,0.0
868.wav,Fight your desire to tell everything,0.0,1.0,0.0,0.0,0.0,0.0,0.0
869.wav,"you take general communication classes, such as intercultural communication",0.0,0.0,0.6666667,0.0,0.0,0.0,0.0
870.wav,"and I had a speech pathologist come to help me with my speech, so I want to the thing for other kids",1.0,0.33333334,0.6666667,0.0,0.0,0.0,0.0
871.wav,"Oh, I saw the stop sign, officer, but I didn't know it meant stop driving",0.0,0.33333334,0.33333334,0.33333334,1.0,0.0,0.0
872.wav,"Well, to answer that, we have to do some statistical inference",0.6666667,0.33333334,0.0,0.0,0.0,0.0,0.0
873.wav,And then I heard about a job at the University of Michigan.,1.0,1.3333334,0.0,0.0,0.33333334,0.0,0.0
874.wav,"And I walked into this gentleman's room, and he was crying.",-0.33333334,0.6666667,0.6666667,0.0,1.3333334,0.0,0.0
875.wav,"And at first, I was really concerned, because I was like, why is this patient crying?",-0.33333334,0.33333334,0.6666667,0.0,0.0,0.0,0.0
876.wav,"And he looked at me, and I asked him, you know, Mr. So and So, why are you crying?",0.33333334,0.6666667,0.6666667,0.0,0.6666667,0.0,0.0
877.wav,"""McKinley Titans, bow down to your new leaders",1.3333334,1.6666666,0.0,0.0,0.0,0.0,0.0
878.wav,""" Number Five: Quinn is pregnant Preggers",0.33333334,0.0,0.0,0.0,0.33333334,0.0,0.0
879.wav,""" ""I'm pregnant"" Season one introduced us to the squeaky-clean Quinn Fabray",-0.6666667,0.0,0.0,0.0,0.0,0.0,0.0
880.wav,"So it came as a shock to viewers, and especially Finn, when Quinn got pregnant",0.0,0.0,0.0,0.0,0.33333334,0.0,0.0
881.wav,The cabinet is united in strongly opposing the proposed deal.,0.33333334,0.33333334,0.0,1.0,0.0,0.0,0.0
882.wav,"I was in Altoona, I was in Clairton -- those school districts have to work.",-0.33333334,0.0,0.33333334,0.0,0.0,0.0,0.0
883.wav,We have a real budget crisis that we're facing here in Pennsylvania.,-1.0,0.0,0.6666667,0.0,0.0,0.33333334,0.33333334
884.wav,I think it's more about how people act inside your organization.,0.6666667,0.6666667,0.0,0.0,0.6666667,0.0,0.0
885.wav,A debt ratio of 0.50 means that debt finances half the assets.,0.33333334,0.0,0.33333334,0.0,0.0,0.0,0.0
886.wav,  We’ll use the highlighted total assets to determine the debt ratio.,0.33333334,0.33333334,0.0,0.0,0.0,0.0,0.0
887.wav,It tells us what percentage of assets are financed with debt.,0.33333334,0.0,0.0,0.6666667,0.0,0.0,0.0
888.wav,"BENJAMIN CARDIN: First, let me agree with Sen",1.3333334,0.0,0.33333334,0.0,0.0,0.0,0.0
889.wav,There's a lot of ways that you can reduce health care costs,1.0,0.6666667,0.0,0.0,0.0,0.0,0.0
890.wav,We reduce hospital infection rates,0.0,0.0,0.0,0.0,0.0,0.0,0.0
891.wav,"So for example, what do you want blue to stand for",0.0,0.6666667,0.0,0.0,0.0,0.0,0.0
892.wav," Yeah, that we had to give it",0.33333334,0.33333334,1.0,0.0,0.0,0.0,0.0
893.wav, We had no choice,0.0,0.0,1.0,0.0,0.0,0.0,0.0
894.wav, That was when she had her first full-fledged anaphylactic episode,-0.6666667,0.0,0.6666667,0.0,0.0,0.0,0.33333334
895.wav, And we could hear her throat starting to close,-1.3333334,0.0,1.3333334,0.0,0.33333334,0.0,0.0
896.wav, I'm haunted by that sound,-1.6666666,0.0,0.6666667,0.0,0.0,0.0,1.0
897.wav, Or just a colleague or a friend who's doing similar work,0.6666667,0.33333334,0.0,0.0,0.0,0.0,0.0
898.wav, So just keep going,1.6666666,2.0,0.0,0.0,0.0,0.0,0.0
899.wav,"To do so, if you want to get involved in that, I invite you to do so",0.33333334,0.0,0.0,0.0,0.0,0.0,0.0
900.wav,Same stuff I'm doing now,1.0,0.0,0.0,0.0,0.0,0.0,0.0
901.wav,So I want to be the one up front,0.0,0.0,0.0,1.0,0.0,0.0,0.0
902.wav,I did it in my early 20s,0.0,0.0,0.0,0.0,0.0,0.0,0.0
903.wav,It's one step at a time,0.0,0.33333334,0.33333334,0.0,0.0,0.0,0.0
904.wav,are never going to buy you're products,1.3333334,1.6666666,0.0,0.0,0.0,0.0,0.0
905.wav,The reason for that is simple,0.33333334,0.33333334,0.0,0.0,0.0,0.0,0.0
906.wav,IT'S BEEN A TOUGH DAY FOR OUR NAVY FAMILY,-1.3333334,0.0,1.0,0.0,0.0,0.0,0.0
907.wav," IT'S HARD TO IMAGINE WHAT THIS CREW HAS HAD TO ENDURE, THE CHALLENGES THEY'VE HAD TO OVERCOME",-0.33333334,0.0,0.33333334,0.0,0.0,0.0,0.0
908.wav, Lately I’ve been blogging about building a customer base from scratch,1.0,0.6666667,0.0,0.0,0.0,0.0,0.0
909.wav," So, that’s when I decided to go to culinary art school",0.33333334,0.33333334,0.0,0.0,0.0,0.0,0.0
910.wav,"My name is Roni Ballas, 24 Years old",1.3333334,1.3333334,0.0,0.0,0.0,0.0,0.0
911.wav, going to start my degree in the IDC this year,0.33333334,2.3333333,0.0,0.0,0.0,0.0,0.0
912.wav," I got to a high position in a technological organization, but something is still missing",2.6666667,2.6666667,0.0,0.0,0.0,0.0,0.0
913.wav,Sega would have never had to develop their ‘mario killer’ in the first place,0.6666667,0.6666667,0.0,0.0,0.0,0.0,0.0
914.wav,"- All right, I see you have a knife, okay",-1.0,0.0,1.0,0.0,0.0,0.0,0.0
915.wav,I see you have some blood on your wrists,-2.6666667,0.0,3.0,0.0,0.0,0.0,0.0
916.wav,We sometimes lose that balance,0.0,0.0,0.6666667,0.0,0.0,0.0,0.0
917.wav,- With liberty and justice for all,0.0,0.0,0.0,0.0,0.0,0.0,0.0
918.wav,Australia's mining industry has become one of the largest sectors of the nation's economy.,0.6666667,1.3333334,0.0,0.0,0.0,0.0,0.0
919.wav, It's not to go back to the past because the future is going to be different.,0.0,0.0,0.0,0.0,0.0,0.0,0.0
920.wav, It kind of renews it and fills it with moisture,0.0,0.0,0.33333334,0.0,0.0,0.0,0.0
921.wav, And the skin just feels smooth and hydrated and silky,0.6666667,1.3333334,0.0,0.0,0.0,0.0,0.0
922.wav, I really enjoy these products,1.0,1.3333334,0.0,0.0,0.0,0.0,0.0
923.wav, You put it on and your skin just drinks it up,0.33333334,0.33333334,0.0,0.0,0.33333334,0.0,0.0
924.wav, That's why we also collaborate with edX on the Open edX platform,0.6666667,0.0,0.0,0.0,0.0,0.0,0.0
925.wav, Let us know about the courses you create with Course Builder,1.0,1.0,0.0,0.0,0.0,0.0,0.0
926.wav,You don't job interview very often,1.0,1.6666666,0.0,0.0,0.0,0.0,0.0
927.wav,You're not a trained interrogator likely,0.6666667,0.6666667,0.0,0.0,0.0,0.0,0.0
928.wav,You need to know whether it's a good company,0.33333334,0.33333334,0.33333334,0.0,0.0,0.0,0.0
929.wav,After being kidnapped for and imprisoned for fifteen years a man is released and is set out to find his captor,0.33333334,0.33333334,0.0,0.0,0.0,0.0,0.0
