file_name,text,sentiment,happy,sad,anger,surprise,disgust,fear
1295.wav,You can view that video by clicking here,0.6666667,0.33333334,0.0,0.0,0.0,0.0,0.0
1296.wav,Or you can view a video on each of the individual tenses in more detail,0.6666667,0.0,0.0,0.0,0.0,0.0,0.0
1297.wav,By clicking on these links,0.0,0.0,0.0,0.0,0.0,0.0,0.0
1298.wav,"the fifth most popular programming language this year was ruby, yet it is the highest paid, Do you want to know what are their characteristics, salary, it does and where it is used?",1.3333334,2.3333333,0.0,0.0,0.0,0.0,0.0
1299.wav,"as we will see in this video Ruby is a language reminiscent of Johan Cruyff, is lightweight, fast, smart, very creative, one enjoys programming in ruby Do you know Johan Cruyff demanded to be recognized as the best player in the world?",0.6666667,1.0,0.0,0.0,0.0,0.0,0.0
1300.wav,"Its developers like us perceive average more than $ 109,000 annually in the description of this video I leave a link with interesting documentation if you want to learn to program in Ruby If you enjoyed this review you can give like, share so that more people know about these data and subscribe to the channel where you will find more reviews of many other languages, greetings",0.0,0.6666667,0.0,1.0,0.0,0.0,0.0
1301.wav,A new study from Accenture has found that citizens across the world are concerned about their prospects for retiring.,0.33333334,0.33333334,0.0,0.0,0.0,0.0,0.0
1302.wav,Even the citizens of wealthier nations such as South Korea are nervous about their retirement prospects.,0.0,0.6666667,0.33333334,0.0,0.0,0.0,0.0
1303.wav,Nearly 95% of South Koreans are concerned they might not have enough money for a comfortable retirement.,-1.3333334,1.6666666,0.33333334,0.0,0.0,0.0,0.33333334
1304.wav,"Hi! It's Neil here from Best Mate Coaching I'm excited and delighted to announce that in September and October I'll be hosting the Better Man Seminar Series it's 6 live hour-long workshops where you learn how to be a better man in all aspects of your life In work, with your friends, with your partner even by yourself we'll discuss the key principles that will set you up for success and by the end you'll have clear goals, a solid plan and the right skill set, and mindset to make it happen And here's the best bit of all",2.3333333,2.6666667,0.0,0.0,0.0,0.0,1.0
1305.wav,"to bring holiness into the world, to be a blessing",0.0,0.0,0.0,0.0,0.0,0.0,0.0
1306.wav,"When we Nitzavim, when we stand up, we bring blessing into the world",0.6666667,0.33333334,0.0,0.0,0.0,0.0,0.0
1307.wav,"They heard God's call of Nitzavim, and they led the Jewish people as allies and as partners for the important work of racial justice in American",1.3333334,0.33333334,0.0,0.33333334,0.0,0.0,0.0
1308.wav,"And so it was that one such leader, Kivie Kaplan, challenged our movement",-1.3333334,0.0,0.0,1.0,0.0,1.3333334,0.0
1309.wav,He was the president of the NAACP,0.0,0.0,0.0,1.0,0.0,0.0,0.0
1310.wav,"He was the last white Jewish president of the NAACP, And also a member of our board of the Reform Jewish Movement",1.3333334,0.0,0.0,0.6666667,0.0,0.0,0.0
1311.wav,"You obviously have to have students do assignments and do work, but you've got all these hundreds of papers that you have to deal with.",0.6666667,1.0,0.0,0.33333334,0.0,0.0,0.0
1312.wav,Something else that I find very useful is have the students email their assignments.,0.6666667,0.6666667,0.0,0.33333334,0.0,0.0,0.0
1313.wav,"I make the student, give them a deadline and they have to email their assignments to me.",0.0,0.6666667,0.0,0.33333334,0.0,0.0,0.0
1314.wav,"You could also, if you're using a seating chart, you could pick up and hand out papers according to that seating chart.",0.0,0.33333334,0.0,0.33333334,0.0,0.0,0.0
1315.wav,"But again, you want to be careful about that because that can be a little time consuming when you're talking about a hundred or more students in a class.",-0.33333334,0.33333334,0.0,0.33333334,0.33333334,0.0,0.0
1316.wav,Several things that you can do to help minimize the difficulty in this is have travel folders.,0.0,1.0,0.0,0.33333334,0.0,0.0,0.0
1317.wav,"Any people who are very big online like Mike Diller, Frank Curn and Russell Bronson to lesser known names",0.0,0.0,0.0,0.0,0.0,0.0,0.0
1318.wav,background that say: What motivates you to engage on social media,0.0,0.33333334,0.0,0.0,0.0,0.0,0.0
1319.wav,Absolutely that is an excellent question and yes I consider the Virgin Islands to be rural and I am sure that I am not the only one,0.0,0.0,0.0,0.0,0.6666667,0.0,0.0
1320.wav,"The way forced labour works in the world today is very different from the way it worked in the 1930s, that it's very much a private sector problem, 90% of those in forced labour are in the private sector.",0.0,0.6666667,0.0,0.0,0.0,0.0,0.0
1321.wav,What this study does is for the first time not only reaffirm the size and scale of the 21 million people who are involved in forced labour and victims of it -- but it also puts an economic value on that and breaks it down in a way that even a private sector company can appreciate that this encompasses many industrial sectors and accounts for about a third of the overall profits globally.,1.3333334,1.0,0.0,0.0,0.0,0.0,0.0
1322.wav,This has value because I can go to our supply chain and procurement people but I can also go to organisations like the Global Business Coalition against trafficking and saying this study validates why we have to work very hard on this.,-0.33333334,0.33333334,0.33333334,0.0,0.0,0.0,0.6666667
1323.wav,"What's evident is that the ILO needs to reinvigorate its action  against forced labour by coming up with a supplemental instrument that fills the implementation gaps in terms of protection, prevention and remedy for victims of forced labour so it has significant policy implications.",0.33333334,0.0,0.6666667,0.0,0.0,0.0,0.0
1324.wav,"When you have 21 million people engaged in forced labour, it will not end tomorrow but collectively, the only way it will end is if we all work together to solve the problem.",-0.6666667,0.0,0.0,0.0,0.0,0.0,0.33333334
1325.wav,"When you're working with routers, you're working with firewalls, you're working with other devices.",0.0,0.0,0.0,0.0,0.0,0.0,0.0
1326.wav,One of the challenges you have is that you're providing very sensitive security information to those devices.,0.0,0.33333334,0.0,0.0,0.0,0.0,0.0
1327.wav,"So you really have to go through and audit, make sure that you have changed all those passwords.",0.6666667,0.33333334,0.0,0.0,0.0,0.0,0.0
1328.wav,You also have to think about how you're communicating to the device.,0.0,0.0,0.0,0.33333334,0.0,0.0,0.0
1329.wav,Are you communicating over a channel that's in the clear traffic?,-1.0,0.0,0.0,0.33333334,0.0,0.33333334,0.0
1330.wav,You want to communicate to this device in an encrypted form.,0.0,0.33333334,0.0,0.0,0.0,0.0,0.0
1331.wav,"Or HTTPS, which uses encrypted communication to these devices.",1.0,0.6666667,0.0,0.0,0.0,0.0,0.0
1332.wav,"You don't want anybody to have access to that, except for you and the other security professionals in your environment.",0.0,0.0,0.33333334,0.0,0.0,0.0,0.0
1333.wav,"If you got your hands on a firewall, or a router log, or a router configuration, there's a lot of good information in there, that bad guys would be able to use.",0.33333334,0.0,0.0,0.0,0.0,0.0,0.0
1334.wav,You also have to think about the way that your configurations are being stored.,0.0,0.0,0.0,0.33333334,0.0,0.0,0.0
1335.wav,"Are they stored on the device, are they stored in an encrypted form?",0.0,0.0,0.0,0.0,0.0,0.0,0.0
1336.wav,"Are you transferring them, and putting them in a network location as a backup?",0.0,0.0,0.0,0.0,0.33333334,0.0,0.0
1337.wav,"Every device works a little bit differently on how it stores data, and how it secures data.",0.0,0.33333334,0.0,0.0,0.0,0.0,0.0
1338.wav,"You need to think about what you're doing with this data-- both on the device, and once you take it off the device.",0.6666667,0.33333334,0.0,0.0,0.0,0.0,0.0
1339.wav,"I work for Oceana in the office of South America, which is in Santiago, Chile.",0.0,0.0,0.0,0.0,0.0,0.0,0.0
1340.wav,"And I'm here in Qatar to help all the group, we are working in a team, and working toward protecting and trying to manage in a better way many of the resources of the world, which is basically now sharks and also Bluefin tuna and corals.",0.33333334,0.0,0.6666667,0.0,0.0,0.0,0.0
1341.wav," The program was fun, challenging, there was plenty to do all the time.",0.6666667,0.6666667,0.0,0.0,0.33333334,0.0,0.0
1342.wav, I enjoyed knowing a completely different culture to know the people from the  Mayan community.,0.33333334,0.33333334,0.6666667,0.33333334,0.0,0.33333334,0.0
1343.wav,I recommend  to all the people  that want to visit Mexico or want  to know a completly different culture and prepared for an academic semester at Tec.,-0.33333334,0.0,0.0,0.0,0.0,0.0,0.33333334
1344.wav,The Merida Summer Program consists  in a Spanish course  and a Mayan  community program.,0.0,0.0,1.0,0.5,0.0,0.5,0.0
1345.wav,You will learn Spanish   and this will be an advantage to study at Tec.,0.0,0.0,0.0,0.0,0.0,0.0,0.0
1346.wav, The other subject was about to visit an small community were we help the people to learn about nutrition and physical exercise  and things they didn't know before.,0.0,0.33333334,0.6666667,0.0,0.0,0.0,0.0
1347.wav,It was a really great experience to get to know a completly different culture from my country  and Mexico and Europe.,0.33333334,0.33333334,0.6666667,0.33333334,0.0,0.6666667,0.0
1348.wav,I decided to sign up to this program because  I wanted to learn Spanish and have a month  to get used to Mexico and the culture  before I started  the academic semester at Tec.,0.0,0.0,1.0,0.0,0.0,0.0,0.0
1349.wav,"When I arrived to Monterrey I  already knew some things about the culture and  the language, my Spanish was better.",0.0,0.0,0.0,0.0,0.0,1.0,0.33333334
1350.wav,[music] I love the option of PrEP because it makes me feel like I'm protected from something that has stigmatized my community,2.0,1.6666666,1.0,0.0,0.0,0.0,0.0
1351.wav,"It's a big plus for me because to be able to know that I take prep, and take it faithfully that I don't necessarily have to worry about getting HIV",1.3333334,1.3333334,0.0,0.0,0.0,0.0,0.0
1352.wav,"It doesn't protect from other STIs but HIV is one of the biggest diseases among black trans women, and to know that I am protected",-1.3333334,0.0,0.0,0.0,0.0,0.0,0.0
1353.wav,"JP Rangaswami JP: Yes I think China will actually help pull us out of the economic crisis we're in, but for reasons that may be different from what is perceived.",0.6666667,0.6666667,0.33333334,0.0,0.0,0.0,0.0
1354.wav,"Fundamentally, we need innovation to get us out of this crisis.",-0.33333334,0.0,0.0,0.0,0.0,0.0,0.33333334
1355.wav,Innovation is key and I think that the role that China plays because talent knows no voters is going to be absolutely critical.,1.0,0.6666667,0.0,0.0,0.0,0.0,0.0
1356.wav,So the answer may not be quite what you guys were expecting.,0.0,0.0,0.0,0.0,0.0,0.0,0.0
1357.wav,"Whoever wrote those books, the world is no better off knowing who the actual person is",-1.0,0.0,0.6666667,0.0,0.0,0.33333334,0.0
1358.wav,I think we’ve all completely lost perspective,-1.6666666,0.0,0.0,0.0,0.0,0.0,0.0
1359.wav,Eastern on Monday and can be seen live on CNN,0.0,0.0,0.0,0.0,0.0,0.0,0.0
1360.wav,CNN anchor Jake Tapper and chief political correspondent Dana Bash will moderate the event from Washington D,0.0,0.0,0.0,0.0,0.0,0.0,0.0
1361.wav,"Cassidy and Graham are co-authors of the newest effort to repeal and replace the Affordable Care Act, and Sanders recently introduced a “Medicare for all” bill",-0.33333334,0.0,0.33333334,0.0,0.0,0.0,0.33333334
1362.wav,The Senate has until the end of September to pass a bill with a simple majority — 51 votes — under the reconciliation procedure,-0.33333334,0.0,0.0,0.0,0.0,0.0,0.0
1363.wav,"Deloitte has announced that it has purchased all assets of IE Discovery, a company specializing in electronic discovery management and litigation support systems.",0.6666667,0.33333334,0.0,0.0,0.0,0.0,0.0
1364.wav,happens and it asks the question what would happen then and the best comedies then develop that premise through character,0.33333334,0.33333334,0.0,0.0,0.0,0.0,0.0
1365.wav,"So after you have the WTF moment, you have what we call the Reaction",0.0,0.0,0.0,0.0,0.0,0.0,0.0
1366.wav,have included a nightly discussion about what a failure we are,-0.33333334,0.0,0.0,0.33333334,0.0,0.0,0.0
1367.wav,"” A beloved performer and comedic genius, Letterman sure sounds like Mr",1.3333334,1.0,0.0,0.0,0.0,0.0,0.0
1368.wav,Maybe he was just frustrated he wasn’t allowed to grow his beard,-0.33333334,0.0,0.0,0.0,0.0,0.0,0.0
1369.wav,I have three kids with my first wife and I don’t see any of them,-1.3333334,0.0,0.0,1.0,0.0,0.0,0.0
1370.wav,I can’t quit smoking and I get drunk every night and I chase all the p---- I can get,-1.3333334,0.0,0.0,0.0,0.0,0.0,0.0
1371.wav,"I love teaching, because I appreciate the fact that students are absolutely eager to learn and they are also energetic.",2.0,2.0,0.0,0.33333334,0.0,0.0,0.0
1372.wav,"Tip number one, all you need to know about this course is on syllabus.",1.0,1.0,0.0,0.0,0.0,0.0,0.0
1373.wav,You need to pay attention to the details and finally you need to take the syllabus quiz.,0.0,0.0,0.33333334,1.0,0.0,0.0,0.0
1374.wav,It's just for your practice and it's going to help you to familiarize yourself with the course.,0.6666667,0.6666667,0.6666667,0.33333334,0.0,0.0,0.0
1375.wav,"Tip number two, plan to spend an average of 9 hours per week for this course and manage your time in a way that you don't get behind.",1.0,1.0,0.0,0.0,0.0,0.0,0.0
1376.wav,Let me introduce myself and I want to give you a few tips about the course.,1.0,0.6666667,0.0,0.0,0.0,0.0,0.0
1377.wav,"Tip number three,  complete your assignments as early as possible.",1.0,0.6666667,0.0,0.0,0.0,0.0,0.0
1378.wav,you don't want to miss the deadline because of the technical and network problems.,0.0,1.0,0.33333334,0.0,0.0,0.0,0.0
1379.wav,Please feel free to email me if you have any questions about the course.,0.6666667,0.6666667,0.0,0.0,0.0,0.0,0.0
1380.wav,I wish you a great learning experience in our online classroom.,1.0,1.3333334,0.0,0.0,0.0,0.0,0.0
1381.wav,My career in teaching started with my first tutoring job in high school followed by teaching at many different places.,1.3333334,1.6666666,0.0,0.33333334,0.0,0.0,0.0
1382.wav,"Hi my name is Meagan Leonard I'm a sophomore here at University of Kentucky I'm studying Integrated Strategic Communication, or ISC Whenever people ask me what my major is I always get kind of nervous if it's in any sort of like icebreaker or just getting to know me because if you're not too familiar with ISC it's kind of hard to explain in just a few minutes or if you just do an icebreaker in class",0.33333334,0.6666667,0.0,0.0,0.0,0.0,0.0
1383.wav," Most the time I sometimes lie and I say that it's a mix between marketing and communications because that's the easiest way how to explain it but, overall it's a very broad major and I'm excited to see what's going to happen in the next few years with it For my fun fact I'm going to tell you about when I was in the third grade, I was featured in the film We are Marshall Which is a movie based on a true story about how the football team from Marshall was coming back from a game in Florida It was rainy and really dark that night and the plane crashed into the mountainside in Huntington, which was only a few miles from the airport",-0.6666667,0.33333334,0.33333334,0.0,0.0,0.0,0.0
1384.wav, In 2006 producers and directors came to Marshall and filmed about how the school recovered from the plane crash and how the football team was rebuilt,-0.6666667,0.0,0.33333334,0.0,0.0,0.0,0.0
1385.wav, That day I went to work with my mom and I was walking to the student center and some guy asked us if I wanted to be featured in a movie so I think any nine-year-old would have said yes and I did and she let me,0.6666667,0.6666667,0.0,0.0,0.33333334,0.0,0.0
1386.wav," I was in the scene whenever Matthew McConaughey was looking out the window and people were shouting ""We Are",0.6666667,1.0,0.0,0.0,0.0,0.0,0.0
1387.wav," Marshall!"" to get the team really hyped up because the reporters were doubting if the football team could get started up again",1.0,1.0,0.0,0.0,0.0,0.0,0.0
1388.wav, It's a really good film I highly recommend it to anyone who wants to shed light on what my town's history is about,1.6666666,0.6666667,0.0,0.0,0.0,0.0,0.0
1389.wav,There's a certain limit that the government has said that you can place in to your IRA.,0.0,0.0,0.33333334,0.33333334,0.0,0.0,0.0
1390.wav,"This is Patrick Munro, answering the question, can I place a lump sum into my traditional IRA?",0.0,0.0,0.33333334,0.33333334,0.0,0.0,0.0
1391.wav,Should victory visit Hillary Clinton’s door it shall not come bearing a mandate for a grand new vision or bold new policy direction,-0.33333334,0.0,0.0,0.33333334,0.0,0.33333334,0.0
1392.wav, History will simply note that voters found her less objectionable than her opponent,-0.6666667,0.0,0.0,0.33333334,0.0,0.0,0.0
1393.wav, The establishment Wing and their neocon allies are already exiting the Republican tent,-1.6666666,0.0,0.0,1.0,0.0,0.0,0.0
1394.wav," The blue collar, working class wing that has been a reliable Republican voting block may soon be looking for looking for a new tent",0.0,0.0,0.0,0.0,0.0,0.0,0.0
1395.wav," The wings of the Republican coalition are so deeply divided on entitlements, trade, immigration, when and where to fight wars that even a Trump victory will not again unite them",-2.6666667,0.0,0.6666667,1.3333334,0.0,1.3333334,0.0
1396.wav, This election has laid raw the stark divisions inside the American Political parties,-1.3333334,0.0,0.0,0.33333334,0.0,0.33333334,0.0
1397.wav, A change and a realignment is inevitable,-0.33333334,0.0,0.33333334,0.0,0.0,0.0,0.0
1398.wav," What has not, and will not change is this: An entire generation of Americans have been left behind by our current political parties; their piece of the American dream denied",-2.0,0.0,1.0,1.3333334,0.0,1.0,0.0
1399.wav, They will soon be looking for someone willing to speak for them,0.0,0.0,0.0,0.0,0.0,0.0,0.0
1400.wav, Have questions? Hit the comment button,0.33333334,0.0,0.0,0.33333334,0.0,0.0,0.0
1401.wav, Or email me at Jay@JayTownsend,0.33333334,0.0,0.0,0.0,0.0,0.0,0.0
1402.wav,com Be sure to visit JayTownsend,0.0,0.0,0.0,0.6666667,0.0,0.0,0.0
1403.wav," Having stuck with her, the Bernie Sanders wing of the democratic party will want its due",0.0,0.0,0.0,0.0,0.0,0.0,0.0
1404.wav,"com to get your copy of my free book, The 10 Worst Mistakes candidates make",-0.33333334,0.0,0.0,0.0,0.0,0.0,0.0
1405.wav, And it will be difficult for Mrs,-1.3333334,0.0,0.33333334,0.6666667,0.0,0.33333334,0.0
1406.wav, Clinton to make them happy,-0.33333334,0.0,0.0,0.0,0.33333334,0.0,0.0
1407.wav," They are a populist bunch, hell bent on massive redistribution of wealth, and not interested in fighting new wars in the middle east, or another cold war with Russia",-1.0,0.0,0.33333334,0.6666667,0.0,0.6666667,0.0
1408.wav, Clinton cannot please the Sanders wing without alienating those on Wall Street that helped pay her bills,-1.6666666,0.0,0.6666667,0.6666667,0.0,0.6666667,0.0
1409.wav, She cannot pay for the Sanders wing wish list without breaking her no-new-taxes promise to the middle class,-1.0,0.0,0.0,0.6666667,0.0,0.6666667,0.0
1410.wav, The Republican Party has already cracked,-1.3333334,0.0,0.0,0.0,0.0,0.33333334,0.0
1411.wav, The evangelical wing has lost its moral compass and shed its credibility as the arbiter of the good and the holy,-1.6666666,0.0,0.0,0.6666667,0.0,0.0,0.0
1412.wav,"In conjunction with the investment, for which the terms were not released, Mr. Ned Goodman, President and CEO of Dundee, has joined the CNSX Board as Deputy Chairman.",0.6666667,0.33333334,0.0,0.0,0.33333334,0.0,0.33333334
1413.wav,"Thomas Caldwell, President and CEO of Urbana Corporation (TSX:URB.A), and CNSX Chairman stated, ""We are pleased to welcome a business leader of Ned's stature to the Board.",0.33333334,1.3333334,0.0,0.0,0.0,0.0,0.0
1414.wav,"With his contribution we expect to accelerate the steady growth CNSX has seen this year, as we continue to enhance CNSX's role as the 'Exchange for Entrepreneurs' in Canada."" Ned Goodman commented, ""I have been impressed for some time with CNSX's approach to helping entrepreneurs access the public capital markets in Canada.",1.6666666,1.6666666,0.0,0.6666667,0.0,0.0,0.0
1415.wav,"As a lifelong entrepreneur I have no problem encouraging and inviting the management and boards of entrepreneurial Canadian public companies to consider the benefits of a CNSX listing."" Through Dundee, Goodman has been an early-stage investor in a number of sectors, including energy, real estate, mining and metals.",2.3333333,1.6666666,0.0,0.0,0.0,0.0,0.0
1416.wav,"I'm Samantha Deutscher for InvestmentPitch.com For more video news, and to view our disclaimer, be sure to visit our website at www.investmentpitch.com This video is for information purposes only and is not a recommendation to buy or sell any securities.",2.0,1.0,0.0,0.6666667,0.0,0.0,0.0
1417.wav,Rob Lowe was central target and conservative pundit Anne Coulter took a brutal comedic beating.,0.0,0.0,0.0,0.0,0.0,0.0,0.0
1418.wav,"Keep listening for scoop on Sully, the new movie hitting theaters this weekend starring Tom Hanks.",0.0,0.0,0.0,0.0,0.0,0.0,0.0
1419.wav,"And they’ve really interacted very interestingly with web search and Facebook and Twitter and other social networking that they’re doing out there, and word of mouth where they bring people together to talk about techniques in organization.",0.33333334,0.33333334,0.0,0.0,0.0,0.0,0.33333334
1420.wav,"But for the 4x6s and the 5x7s I went out seeking, okay, what’s the best solution for me.",0.33333334,0.33333334,0.0,0.0,0.0,0.0,0.0
1421.wav,And it really came down to something like a CVS or a Walgreens being my printer of choice because not only could I upload to their site in a very intuitive fashion.,1.3333334,0.6666667,0.0,0.0,0.0,0.0,0.0
1422.wav,And I could even pay for them and it would take an hour for me to get it to them.,0.0,0.33333334,0.0,0.0,0.0,0.0,0.6666667
1423.wav,And so that’s the example of me having a very satisfying experience.,1.3333334,1.3333334,0.0,0.0,0.0,0.0,0.0
1424.wav,And they were the first to really exalt the retail space as what they call the first moment of truth.,0.0,0.0,0.0,0.0,0.0,0.0,0.0
1425.wav,"The first moment of truth is when the consumer, faced with an array of choices reaches out and selects what they would hope would be a Proctor and Gamble product, and the second moment of truth is when they take it home and they use it or the parlance is, when she chooses and when she uses.",1.0,0.6666667,0.0,0.0,0.0,0.0,0.0
1426.wav,"So what they now look at, they call it store back, but they say that moment of truth is the most important part of their whole marketing process.",0.33333334,0.6666667,0.0,0.0,0.0,0.0,0.33333334
1427.wav,"So agencies that now present at P &amp; G have to start their big-- showing how their big idea works at retail, and then how that would be translated into on line or circulars or other places that we might go to get information when we’re getting ready to shop, all the way back up to radio, print, television.",1.0,1.6666666,0.0,0.0,0.0,0.0,0.0
1428.wav,He even calls poets liars because their representations of reality are by nature far removed from the truth,0.0,0.0,0.0,0.0,0.0,0.0,0.0
1429.wav,"However poets may try, their poetry is a poor imitation of an imitation of a reality, and so these representations are not to be valued more than Truth itself",0.0,0.0,0.0,0.0,0.0,0.0,0.0
1430.wav,"Fortunately, another great Greek philosopher did not agree with these accusations and came to the rescue of art",1.0,0.0,0.0,0.0,0.0,0.0,0.0
1431.wav,"Aristotle, in his Poetics, tried to refute Plato's argument",0.33333334,0.33333334,0.0,0.0,0.0,0.0,0.0
1432.wav,He said that poets do not claim to portray reality as it is,0.0,0.0,0.0,0.0,0.0,0.0,0.0
1433.wav,"rather, they portray reality as it should be",0.6666667,0.0,0.0,0.0,0.0,0.0,0.0
1434.wav,"The reality of our lives is messy and difficult to endure, so poets set out to create form to bear on the choas of reality",0.0,0.0,0.0,0.0,0.0,0.0,0.0
1435.wav,"Just thinking that, and what that is, and what that means to us who declare him to be the savior and the Redeemer the world",0.0,0.0,0.33333334,0.0,0.0,0.0,0.0
1436.wav,"In fact with the economic crisis proving to be much more deep rooted than initially thought, it is unlikely that the situation in the youth labour market is going to improve any time soon.",-0.33333334,0.0,0.33333334,0.0,0.0,0.0,0.0
1437.wav,Now part-time employment in itself is not necessarily a negative thing especially when young people are combining work and studies.,1.3333334,0.0,0.0,0.0,0.0,0.0,0.0
1438.wav,Long-term investment in the education and training system for example; Creative fiscal policy that will subsidize youth employment; these are some of the examples of the solutions that are being called for.,1.3333334,0.0,1.0,0.0,0.0,0.0,0.0
1439.wav,"Unfortunately, they are being called for at a time when governments have very little fiscal space to respond to such action.",-1.0,0.0,0.0,0.0,0.0,0.33333334,0.0
1440.wav,"Fortunately, we have other players that can now step in where governments cannot.",1.0,0.0,0.0,0.33333334,0.0,0.0,0.0
1441.wav,"Many non-state actors, trade unions, workers’ organisations, private enterprises for example are now playing more of an active role to promote youth employment.",1.3333334,0.33333334,0.0,0.0,0.0,0.0,0.0
